{
  "changed_files": [
    "evidence/W01_BACKEND_MAP.md"
  ],
  "next_consumers": [
    "W03"
  ],
  "outputs": [
    {
      "description": "Maps Ollama agent-chat execution, local persistence, trace/eval seams, fixture-vs-live evidence, and constraints for real repeatable agent evaluations at candidate HEAD 1e4d9f930da1225ce61ce27def897f76d57a08fc.",
      "kind": "read_only_backend_architecture_map",
      "path": "evidence/W01_BACKEND_MAP.md",
      "sha256": "d46c0a0c0abf43ab104adf3b3a976c1818f8d75db210ee9bb063e6994c9a2ef1"
    }
  ],
  "payload_sha256": "b6b3e231d155b2141068338b3d28201ad9438d8931c7f4ecb7d540501809af87",
  "residual_risks": [
    "No suite/case/run identity or agent-configuration fingerprint is linked into current agent-chat traces.",
    "Provider errors occur before the current trace writer; a failed request can leave a persisted user message without assistant result or failure trace.",
    "Current LocalTraceEvaluator checks governed execution evidence, not agent response quality; existing chat tests stub the provider.",
    "Trace cost is not reported; LocalTrace and EvaluationReport use a 0.0 default that must not be treated as measured zero cost.",
    "Live Ollama availability, model identity in the local configured provider, and Jaeger projection were not checked in this read-only work item."
  ],
  "role": "evidence-provenance-engineer",
  "status": "DONE",
  "verification": [
    {
      "command": "Read-only source and test-code inspection at candidate HEAD 1e4d9f930da1225ce61ce27def897f76d57a08fc; no product edits, tests, Ollama calls, or runtime data reads.",
      "evidence": "evidence/W01_BACKEND_MAP.md; source locations and NOT_RUN boundaries recorded.",
      "result": "PASS"
    }
  ],
  "work_id": "W01"
}
